{
  "activation": "inert",
  "catalog_version": "0.1.0",
  "content_sha256": "91f9b8e606758fcd65b44d9d5ec4d197ac65ab40aae473f01d06f0ca6123aacf",
  "count": 28,
  "kind": "portable_asset_index",
  "lifecycle_state": "inert",
  "records": [
    {
      "activation": "inert",
      "asset_id": "skill.anomaly-handling",
      "compatibility": "orchestrator>=0.1.0",
      "content_sha256": "de5d03f4038f327e41dc0300f6f41191248924b3641a126e32338774d04f610a",
      "executable": false,
      "kind": "skill_package",
      "lifecycle_state": "inert",
      "notes": "Portable skill package under skills/.",
      "owner": "platform.orchestrator",
      "package_shipped": true,
      "provenance": "r1-design-contract",
      "scheduling_ref": null,
      "sensitivity": "public",
      "source": "skills/anomaly-handling/",
      "version": "0.1.0"
    },
    {
      "activation": "inert",
      "asset_id": "skill.ci-test-triage",
      "compatibility": "orchestrator>=0.1.0",
      "content_sha256": "ce2f1ad982fff05ee83a6a6e6abda0281a9f92401c0c47ebecc3294763a81c79",
      "executable": false,
      "kind": "skill_package",
      "lifecycle_state": "inert",
      "notes": "Portable skill package under skills/.",
      "owner": "platform.orchestrator",
      "package_shipped": true,
      "provenance": "r1-design-contract",
      "scheduling_ref": null,
      "sensitivity": "public",
      "source": "skills/ci-test-triage/",
      "version": "0.1.0"
    },
    {
      "activation": "inert",
      "asset_id": "skill.code-review-risk-triage",
      "compatibility": "orchestrator>=0.1.0",
      "content_sha256": "ad5f27338fe00a4fe71926dafb7771ba07d568d9b5db25a4bf0e4c8e4bc359b9",
      "executable": false,
      "kind": "skill_package",
      "lifecycle_state": "inert",
      "notes": "Portable skill package under skills/.",
      "owner": "platform.orchestrator",
      "package_shipped": true,
      "provenance": "r1-design-contract",
      "scheduling_ref": null,
      "sensitivity": "public",
      "source": "skills/code-review-risk-triage/",
      "version": "0.1.0"
    },
    {
      "activation": "inert",
      "asset_id": "skill.conference-facilitation",
      "compatibility": "orchestrator>=0.1.0",
      "content_sha256": "bf3e7fea9dacd24a1c4e9be6d080506b09c897949755cc56600c954a15823d73",
      "executable": false,
      "kind": "skill_package",
      "lifecycle_state": "inert",
      "notes": "Portable skill package under skills/.",
      "owner": "platform.orchestrator",
      "package_shipped": true,
      "provenance": "r1-design-contract",
      "scheduling_ref": null,
      "sensitivity": "public",
      "source": "skills/conference-facilitation/",
      "version": "0.1.0"
    },
    {
      "activation": "inert",
      "asset_id": "skill.cpprd-changelog-authoring",
      "compatibility": "orchestrator>=0.1.0",
      "content_sha256": "8566f71bda81dd8282426413b96e1097c9af8cc18b05568e06ede6c6a43b6eef",
      "executable": false,
      "kind": "skill_package",
      "lifecycle_state": "inert",
      "notes": "Portable skill package under skills/.",
      "owner": "platform.orchestrator",
      "package_shipped": true,
      "provenance": "r1-design-contract",
      "scheduling_ref": null,
      "sensitivity": "public",
      "source": "skills/cpprd-changelog-authoring/",
      "version": "0.1.0"
    },
    {
      "activation": "inert",
      "asset_id": "skill.dependency-planning",
      "compatibility": "orchestrator>=0.1.0",
      "content_sha256": "bf5154588c53c8d66050ac31f73c6666ef3b9fe247547b858c0470ec7239b380",
      "executable": false,
      "kind": "skill_package",
      "lifecycle_state": "inert",
      "notes": "Portable skill package under skills/.",
      "owner": "platform.orchestrator",
      "package_shipped": true,
      "provenance": "r1-design-contract",
      "scheduling_ref": null,
      "sensitivity": "public",
      "source": "skills/dependency-planning/",
      "version": "0.1.0"
    },
    {
      "activation": "inert",
      "asset_id": "skill.design-first-gate",
      "compatibility": "orchestrator>=0.1.0",
      "content_sha256": "d3d0785a070857d5a6d58a93ae967febbd24571ddf97cf5d5e6eb3e5d2313632",
      "executable": false,
      "kind": "skill_package",
      "lifecycle_state": "inert",
      "notes": "Portable skill package under skills/.",
      "owner": "platform.orchestrator",
      "package_shipped": true,
      "provenance": "r1-design-contract",
      "scheduling_ref": null,
      "sensitivity": "public",
      "source": "skills/design-first-gate/",
      "version": "0.1.0"
    },
    {
      "activation": "inert",
      "asset_id": "skill.documentation-maintenance",
      "compatibility": "orchestrator>=0.1.0",
      "content_sha256": "485559f68023d9a343b471b7e0357269f1b0b752455e74ff422fa88b99cb9336",
      "executable": false,
      "kind": "skill_package",
      "lifecycle_state": "inert",
      "notes": "Portable skill package under skills/.",
      "owner": "platform.orchestrator",
      "package_shipped": true,
      "provenance": "r1-design-contract",
      "scheduling_ref": null,
      "sensitivity": "public",
      "source": "skills/documentation-maintenance/",
      "version": "0.1.0"
    },
    {
      "activation": "inert",
      "asset_id": "skill.execution-supervision",
      "compatibility": "orchestrator>=0.1.0",
      "content_sha256": "51f19d01e18bb3be0faa3e597f10c20441523c7e88431204dcaf101bae44c9dd",
      "executable": false,
      "kind": "skill_package",
      "lifecycle_state": "inert",
      "notes": "Portable skill package under skills/.",
      "owner": "platform.orchestrator",
      "package_shipped": true,
      "provenance": "r1-design-contract",
      "scheduling_ref": null,
      "sensitivity": "public",
      "source": "skills/execution-supervision/",
      "version": "0.1.0"
    },
    {
      "activation": "inert",
      "asset_id": "skill.governance-audit",
      "compatibility": "orchestrator>=0.1.0",
      "content_sha256": "35f3711eea12c2bd99369b5abba1b00d453d735f211d87cf2e6371a7d43979e2",
      "executable": false,
      "kind": "skill_package",
      "lifecycle_state": "inert",
      "notes": "Portable skill package under skills/.",
      "owner": "platform.orchestrator",
      "package_shipped": true,
      "provenance": "r1-design-contract",
      "scheduling_ref": null,
      "sensitivity": "public",
      "source": "skills/governance-audit/",
      "version": "0.1.0"
    },
    {
      "activation": "inert",
      "asset_id": "skill.handoff-contract",
      "compatibility": "orchestrator>=0.1.0",
      "content_sha256": "7d336d0221a1b4971ca7830f84d3f2c363c0e62b3a5b6a1f43f5eef564309efe",
      "executable": false,
      "kind": "skill_package",
      "lifecycle_state": "inert",
      "notes": "Portable skill package under skills/.",
      "owner": "platform.orchestrator",
      "package_shipped": true,
      "provenance": "r1-design-contract",
      "scheduling_ref": null,
      "sensitivity": "public",
      "source": "skills/handoff-contract/",
      "version": "0.1.0"
    },
    {
      "activation": "inert",
      "asset_id": "skill.implementation-loop",
      "compatibility": "orchestrator>=0.1.0",
      "content_sha256": "7793f3dac0f048d5aec8bee7f6eb19ff311f06f0278f340e3b65cedf938f1a7a",
      "executable": false,
      "kind": "skill_package",
      "lifecycle_state": "inert",
      "notes": "Portable skill package under skills/.",
      "owner": "platform.orchestrator",
      "package_shipped": true,
      "provenance": "r1-design-contract",
      "scheduling_ref": null,
      "sensitivity": "public",
      "source": "skills/implementation-loop/",
      "version": "0.1.0"
    },
    {
      "activation": "inert",
      "asset_id": "skill.investigation-report",
      "compatibility": "orchestrator>=0.1.0",
      "content_sha256": "ad589d0c5543055143579db573bdf1663821d38bcb2e352a9a6105bba4375ebd",
      "executable": false,
      "kind": "skill_package",
      "lifecycle_state": "inert",
      "notes": "Portable skill package under skills/.",
      "owner": "platform.orchestrator",
      "package_shipped": true,
      "provenance": "r1-design-contract",
      "scheduling_ref": null,
      "sensitivity": "public",
      "source": "skills/investigation-report/",
      "version": "0.1.0"
    },
    {
      "activation": "inert",
      "asset_id": "skill.loadout-selection",
      "compatibility": "orchestrator>=0.1.0",
      "content_sha256": "d46ea2d8e75b449773919acc4ba309c9a0e69900bf60c6949131ae579885b04e",
      "executable": false,
      "kind": "skill_package",
      "lifecycle_state": "inert",
      "notes": "Portable skill package under skills/.",
      "owner": "platform.orchestrator",
      "package_shipped": true,
      "provenance": "r1-design-contract",
      "scheduling_ref": null,
      "sensitivity": "public",
      "source": "skills/loadout-selection/",
      "version": "0.1.0"
    },
    {
      "activation": "inert",
      "asset_id": "skill.orchestrator-admin-ops-exec",
      "compatibility": "orchestrator>=0.1.0",
      "content_sha256": "95a7110d455337e1d44fe9227c7f1346f438be9ac58246243788eecd4c26d2da",
      "executable": false,
      "kind": "skill_package",
      "lifecycle_state": "inert",
      "notes": "Portable skill package under skills/.",
      "owner": "platform.orchestrator",
      "package_shipped": true,
      "provenance": "r1-design-contract",
      "scheduling_ref": null,
      "sensitivity": "public",
      "source": "skills/orchestrator-admin-ops-exec/",
      "version": "0.1.0"
    },
    {
      "activation": "inert",
      "asset_id": "skill.orchestrator-admin-qa-exec",
      "compatibility": "orchestrator>=0.1.0",
      "content_sha256": "f13c376aca370a81d5e85e4f05c61c53984200d8a31f9726d327464e923b5ca6",
      "executable": false,
      "kind": "skill_package",
      "lifecycle_state": "inert",
      "notes": "Portable skill package under skills/.",
      "owner": "platform.orchestrator",